index,Article Title,Date,Authors,Journal,Study Type,Keywords,DOI,Abstract,Topic of interest,Score,Match
24,Clinician-delivered cognitive training for children with attention problems: effects on cognition and behavior from the ThinkRx randomized controlled trial.,2018,"Moore AL, Carpenter DM 2nd, Miller TM, Ledbetter C",Neuropsychiatric disease and treatment,Journal Article,"ADHD, LearningRx, brain training, cognitive rehabilitation, cognitive training",https://doi.org/10.2147/NDT.S165418,"PURPOSE: The impact of attention problems on academic and social functioning coupled with the large number of children failing to respond to stimulant medication or behavioral therapy makes adjunctive therapies such as cognitive training appealing for families and clinicians of children with attention difficulties or childhood attention deficit hyperactivity disorder. However, the  results of cognitive training studies have failed to find far transfer effects with this population. This study examined the quantitative cognitive effects and  parent-reported behavioral effects of a clinician-delivered cognitive training program with children who have attention problems. PATIENTS AND METHODS: Using a  randomized controlled study design, we examined the impact of a clinician-delivered cognitive training program on processing speed, fluid reasoning, memory, visual processing, auditory processing, attention, overall intelligence quotient score, and behavior of students (n=13) aged 8-14 years with attention problems. Participants were randomly assigned to either a waitlist control group or a treatment group for 60 hours of cognitive training with ThinkRx, a clinician-delivered intervention that targets multiple cognitive skills with game-like, but rigorous mental tasks in 60-90-minute training sessions at least 3 days per week. RESULTS: Results included greater mean pretest to posttest change scores on all variables for the treatment group versus the control group with statistically significant differences noted in working memory, long-term memory, logic and reasoning, auditory processing, and intelligence quotient score. Qualitative outcomes included parent-reported changes in confidence, cooperation, and self-discipline. CONCLUSION: Children with attention problems who completed 60 hours of clinician-delivered ThinkRx cognitive training realized both cognitive and behavioral improvements.",treatment,0.00330760749724366,0
25,A serious game for children with Attention Deficit Hyperactivity Disorder: Who benefits the most?,2018,"Bul KCM, Doove LL, Franken IHA, Oord SV, Kato PM, Maras A",PloS one,"Journal Article, Multicenter Study, Randomized Controlled Trial, Research Support, Non-U.S. Gov't",None,https://doi.org/10.1371/journal.pone.0193681,"OBJECTIVE: The aim of the current study was to identify which subgroups of children with Attention Deficit Hyperactivity Disorder (ADHD) benefitted the most from playing a Serious Game (SG) intervention shown in a randomized trial to improve behavioral outcomes. METHOD: Pre-intervention characteristics [i.e., gender, age, intellectual level of functioning, medication use, computer experience, ADHD subtype, severity of inattention problems, severity of hyperactivity/impulsivity problems, comorbid Oppositional Defiant Disorder (ODD)  and Conduct Disorder (CD) symptoms] were explored as potential moderators in a Virtual Twins (VT) analysis to identify subgroups for whom the SG intervention was most effective. Primary outcome measures were parent-reported time management, planning/organizing and cooperation skills. RESULTS: Two subgroups were identified. Girls (n = 26) were identified as the subgroup that was most likely to show greater improvements in planning/organizing skills as compared to  the estimated treatment effect of the total group of participants. Furthermore, among the boys, those (n = 47) with lower baseline levels of hyperactivity and higher levels of CD symptoms showed more improvements in their planning/organizing skills when they played the SG intervention as compared to the estimated treatment effect of the total group of participants. CONCLUSION: Using a VT analysis two subgroups of children with ADHD, girls, and boys with both higher levels of CD and lower levels of hyperactivity, were identified. These subgroups mostly benefit from playing the SG intervention developed to improve ADHD related behavioral problems. Our results imply that these subgroups  have a higher chance of treatment success.",treatment,0.49944873208379265,1
26,A double-blind randomized pilot trial comparing computerized cognitive exercises  to Tetris in adolescents with attention-deficit/hyperactivity disorder.,2017 Aug,"Bikic A, Christensen TO, Leckman JF, Bilenberg N, Dalsgaard S",Nordic journal of psychiatry,"Comparative Study, Journal Article, Randomized Controlled Trial","ADHD, CANTAB, Tetris, cognitive training, working memory training",https://doi.org/10.1080/08039488.2017.1328070,"BACKGROUND: The purpose of this trial was to examine the feasibility and efficacy of computerized cognitive exercises from Scientific Brain Training (SBT), compared to the computer game Tetris as an active placebo, in a pilot study of adolescents with attention-deficit/hyperactivity disorder (ADHD). METHOD: Eighteen adolescents with ADHD were randomized to treatment or control intervention for 7 weeks. Outcome measures were cognitive test, symptom, and motivation questionnaires. RESULTS: SBT and Tetris were feasible as home-based interventions, and participants' compliance was high, but participants perceived  both interventions as not very interesting or helpful. There were no significant  group differences on cognitive and ADHD-symptom measures after intervention. Pre-post intra-group measurement showed that the SBT had a significant beneficial effect on sustained attention, while the active placebo had significant beneficial effects on working memory, both with large effect sizes. CONCLUSION: Although no significant differences were found between groups on any measure, there were significant intra-group changes for each group.",treatment,0.44432194046306506,1
27,Game-based combined cognitive and neurofeedback training using Focus Pocus reduces symptom severity in children with diagnosed AD/HD and subclinical AD/HD.,2017 Jun,"Johnstone SJ, Roodenrys SJ, Johnson K, Bonfield R, Bennett SJ",International journal of psychophysiology : official journal of the International Organization of Psychophysiology,Journal Article,"*AD/HD, *EEG, *Inhibitory control, *Neurofeedback, *Training, *Working memory",https://doi.org/10.1016/j.ijpsycho.2017.02.015,"Previous studies report reductions in symptom severity after combined working memory (WM) and inhibitory control (IC) training in children with AD/HD. Based on theoretical accounts of the role of arousal/attention modulation problems in AD/HD, the current study examined the efficacy of combined WM, IC, and neurofeedback training in children with AD/HD and subclinical AD/HD. Using a randomized waitlist control design, 85 children were randomly allocated to a training or waitlist condition and completed pre- and post-training assessments of overt behavior, trained and untrained cognitive task performance, and resting  and task-related EEG activity. The training group completed twenty-five sessions  of training using Focus Pocus software at home over a 7 to 8-week period. Trainees improved at the trained tasks, while enjoyment and engagement declined across sessions. After training, AD/HD symptom severity was reduced in the AD/HD  and subclinical groups according to parents, and in the former group only according to blinded teachers and significant-others. There were minor improvements in two of six near-transfer tasks, and evidence of far-transfer of training effects in four of five far-transfer tasks. Frontal region changes indicated normalization of atypical EEG features with reduced delta and increased alpha activity. It is concluded that technology developments provide an interesting a vehicle for delivering interventions and that, while further research is needed, combined WM, IC, and neurofeedback training can reduce AD/HD  symptom severity in children with AD/HD and may also be beneficial to children with subclinical AD/HD.",treatment,0.0,0
28,The Effects of Stimulant Medication and Training on Sports Competence Among Children With ADHD.,2019,"Altszuler AR, Morrow AS, Merrill BM, Bressler S, Macphee FL, Gnagy EM, Greiner AR, Coxe S, Raiker JS, Coles E, Pelham WE Jr","Journal of clinical child and adolescent psychology : the official journal for the Society of Clinical Child and Adolescent Psychology, American Psychological Association, Division 53","Journal Article, Research Support, N.I.H., Extramural, Research Support, Non-U.S. Gov't",None,https://doi.org/10.1080/15374416.2016.1270829,"The current study examined the relative efficacy of behavioral sports training, medication, and their combination in improving sports competence among youth with attention deficit/hyperactivity disorder (ADHD). Participants were 73 youth (74%  male; 81% Hispanic) between the ages of 5 and 12 diagnosed with Diagnostic and Statistical Manual of Mental Disorders (4th ed.) ADHD enrolled in a Summer Treatment Program (STP). The study consisted of a 2 (medication: methylphenidate, placebo) x 2 (sports training: instruction and practice, recreational play) between-groups design and was conducted over a 3-week period during the STP. Sports training was conducted with a novel sport, badminton, to limit previous sport knowledge and to differentiate it from concurrent sports training that occurred within the STP. Objective and subjective measures of sports skills, knowledge, and behavior were collected. Results indicated that, relative to recreational play, brief sports training improved observed and counselor-rated measures of sports competence including sports skills, knowledge, game awareness, effort, frustration, and enjoyment. During sports training, medication incrementally improved children's observed rule following behavior and counselor-rated sportsmanship relative to placebo. In the absence of sports training, medication improved behavior, effort, and sport knowledge. Training in  sports skills and rules produced the largest magnitude effects on sports-related  outcomes. Therefore, skills training, rather than medication alone, should be used in conjunction with behavioral intervention to teach sports to youth with ADHD. It is recommended that medication be used only as an adjunct to highly structured sports skills training for youth who display high rates of negative behavior during sports activities.",treatment,0.16868798235942667,0
29,"Disinhibition in children with attention-deficit/hyperactivity disorder: Changes  in [oxy-Hb] on near-infrared spectroscopy during ""rock, paper, scissors"" task.",2017 May,"Ishii S, Kaga Y, Tando T, Aoyagi K, Sano F, Kanemura H, Sugita K, Aihara M",Brain & development,Journal Article,"AD/HD, Disinhibition, Frontal lobe function, Near-infrared spectroscopy, Rock paper scissors task",https://doi.org/10.1016/j.braindev.2016.12.005,"OBJECTIVE: Attention-deficit/hyperactivity disorder (AD/HD) is a common developmental disorder. Many reports have suggested that symptoms of AD/HD are related to frontal lobe dysfunctions, particularly disinhibition. However, measuring neurological findings with biomarkers during frontal functional tasks has sometimes been difficult in children with AD/HD. This study aimed to investigate frontal inhibitory function objectively in children with AD/HD during ""rock, paper, scissors"" (RPS) tasks, as a familiar game for Japanese children, using near-infrared spectroscopy (NIRS). SUBJECTS AND METHODS: Eighteen children  with AD/HD were compared with 27 typically developing children (TDC). Children from each group were divided into two age groups: younger, 6-10years; and older,  11-16years. Changes in oxygenated hemoglobin [oxy-Hb] were measured in the prefrontal region using NIRS during a 'to lose' RPS task, in which subjects were  asked to present the RPS signal that would lose in response to one of the three signals displayed randomly on a computer screen every 2.0s. RESULTS: The rate of  correct performance with both TDC and AD/HD increased with age. Only in the older group, the rate of correct performance was significantly higher with TDC than with AD/HD. However, children with AD/HD in both age groups showed significantly  lower [oxy-Hb] activity in the prefrontal region during the 'to lose' RPS task, particularly in the dorsolateral area. CONCLUSIONS: Our results suggest that prefrontal region activation during the 'to lose' RPS task could offer a biomarker for diagnosing AD/HD, and may help in the early treatment of AD/HD.",treatment,0.278941565600882,1
30,A Feasibility Study on the Effectiveness of a Full-Body Videogame Intervention for Decreasing Attention Deficit Hyperactivity Disorder Symptoms.,2016 Aug,"Weerdmeester J, Cima M, Granic I, Hashemian Y, Gotsis M",Games for health journal,"Journal Article, Randomized Controlled Trial",None,https://doi.org/10.1089/g4h.2015.0103,"OBJECTIVE: The current study assessed the feasibility and effectiveness of a full-body-driven intervention videogame targeted at decreasing attention deficit  hyperactivity disorder (ADHD) symptoms, specifically inattention, hyperactivity,  impulsivity, and motor deficiency. MATERIALS AND METHODS: The game was tested in  a Dutch sample (N = 73) of school-aged children with elevated ADHD symptoms. Children assigned to the intervention condition played ""Adventurous Dreaming Highflying Dragon,"" and those in the control condition played a comparable full-body-driven game without ADHD-focused training components. Games were played during six 15-minute sessions. Outcomes were teacher-rated ADHD symptoms and scores on neuropsychological tasks assessing motor skills, impulsivity, and sustained attention. RESULTS: There was some indication of greater improvement in the intervention group in comparison to the control group in terms of teacher-rated ADHD symptoms. Both groups showed equal indication of improvement in fine motor skills, but no change was found in gross motor skills. Additionally, both groups showed a deterioration in number of hits (assessing sustained attention) on the go/no-go task. Last, the intervention group showed a  greater increase in false alarms (assessing impulsivity) than the control group.  CONCLUSION: Dragon seems promising as a game-based intervention for children with ADHD. Children who played Dragon improved in several areas with only a short amount of gameplay (1.5 hours in total), and their satisfaction with the game was high. For future research, it is recommended to further inspect Dragon's influence on impulsivity and gross motor skills. Furthermore, it is recommended to disentangle, examine, and evaluate specific properties of videogames that might lead to positive behavioral change.",treatment,0.6229327453142227,1
31,"A Randomized Controlled Trial of an Integrated Brain, Body, and Social Intervention for Children With ADHD.",2020 Mar,"Smith SD, Vitulano LA, Katsovich L, Li S, Moore C, Li F, Grantz H, Zheng X, Eicher V, Aktan Guloksuz S, Zheng Y, Dong J, Sukhodolsky DG, Leckman JF",Journal of attention disorders,"Journal Article, Randomized Controlled Trial, Research Support, N.I.H., Extramural","*ADHD, *Good Behavior Game (GBG), *computerized cognitive remediation training (CCRT), *physical exercise, *randomized controlled trial",https://doi.org/10.1177/1087054716647490,"Objective: This study evaluated the efficacy of an Integrated Brain, Body, and Social (IBBS) intervention for children with ADHD. Treatment consisted of computerized cognitive remediation training, physical exercises, and a behavior management strategy. Method: Ninety-two children aged 5 to 9 years with ADHD were randomly assigned to 15 weeks of IBBS or to treatment-as-usual. Primary outcome measures included blinded clinician ratings of ADHD symptoms and global clinical  functioning. Secondary outcome measures consisted of parent and teacher ratings of ADHD and neurocognitive tests. Results: No significant treatment effects were  found on any of our primary outcome measures. In terms of secondary outcome measures, the IBBS group showed significant improvement on a verbal working memory task; however, this result did not survive correction for multiple group comparisons. Conclusion: These results suggest that expanding cognitive training  to multiple domains by means of two training modalities does not lead to generalized improvement of ADHD symptomatology.",treatment,0.5512679162072767,1
32,Behavioral Outcome Effects of Serious Gaming as an Adjunct to Treatment for Children With Attention-Deficit/Hyperactivity Disorder: A Randomized Controlled Trial.,2016 Feb 16,"Bul KC, Kato PM, Van der Oord S, Danckaerts M, Vreeke LJ, Willems A, van Oers HJ, Van Den Heuvel R, Birnie D, Van Amelsvoort TA, Franken IH, Maras A",Journal of medical Internet research,"Journal Article, Randomized Controlled Trial, Research Support, Non-U.S. Gov't","ADHD, Internet, attention deficit-hyperactivity disorder, children, randomized controlled trial, serious game, treatment",https://doi.org/10.2196/jmir.5173,"BACKGROUND: The need for accessible and motivating treatment approaches within mental health has led to the development of an Internet-based serious game intervention (called ""Plan-It Commander"") as an adjunct to treatment as usual for children with attention-deficit/hyperactivity disorder (ADHD). OBJECTIVE: The aim was to determine the effects of Plan-It Commander on daily life skills of children with ADHD in a multisite randomized controlled crossover open-label trial. METHODS: Participants (N=170) in this 20-week trial had a diagnosis of ADHD and ranged in age from 8 to 12 years (male: 80.6%, 137/170; female: 19.4%, 33/170). They were randomized to a serious game intervention group (group 1; n=88) or a treatment-as-usual crossover group (group 2; n=82). Participants randomized to group 1 received a serious game intervention in addition to treatment as usual for the first 10 weeks and then received treatment as usual for the next 10 weeks. Participants randomized to group 2 received treatment as usual for the first 10 weeks and crossed over to the serious game intervention in addition to treatment as usual for the subsequent 10 weeks. Primary (parent report) and secondary (parent, teacher, and child self-report) outcome measures were administered at baseline, 10 weeks, and 10-week follow-up. RESULTS: After 10 weeks, participants in group 1 compared to group 2 achieved significantly greater improvements on the primary outcome of time management skills (parent-reported; P=.004) and on secondary outcomes of the social skill of responsibility (parent-reported; P=.04), and working memory (parent-reported; P=.02). Parents and teachers reported that total social skills improved over time within groups,  whereas effects on total social skills and teacher-reported planning/organizing skills were nonsignificant between groups. Within group 1, positive effects were  maintained or further improved in the last 10 weeks of the study. Participants in group 2, who played the serious game during the second period of the study (weeks 10 to 20), improved on comparable domains of daily life functioning over time. CONCLUSIONS: Plan-It Commander offers an effective therapeutic approach as an adjunct intervention to traditional therapeutic ADHD approaches that improve functional outcomes in daily life. TRIAL REGISTRATION: International Standard Randomized Controlled Trial Number (ISRCTN): 62056259; http://www.controlled-trials.com/ISRCTN62056259 (Archived by WebCite at http://www.webcitation.org/6eNsiTDJV).",treatment,0.7883131201764058,1
33,Clinical validation of the C-VAT 2.0 assessment tool for gaming disorder: A sensitivity analysis of the proposed DSM-5 criteria and the clinical characteristics of young patients with 'video game addiction'.,2017 Jan,"van Rooij AJ, Schoenmakers TM, van de Mheen D",Addictive behaviors,"Journal Article, Validation Study","*Adolescents, *Assessment tool, *DSM-5, *Internet gaming disorder, *Sensitivity, *Video game addiction",https://doi.org/10.1016/j.addbeh.2015.10.018,"AIMS: Clinicians struggle with the identification of video gaming problems. To address this issue, a clinical assessment tool (C-VAT 2.0) was developed and tested in a clinical setting. The instrument allows exploration of the validity of the DSM-5 proposal for 'internet gaming disorder'. METHOD: Using C-VAT 2.0, the current study provides a sensitivity analysis of the proposed DSM-5 criteria  in a clinical youth sample (13-23years old) in treatment for video gaming disorder (N=32). The study also explores the clinical characteristics of these patients. RESULTS: The patients were all male and reported spending extensive amounts of time on video games. At least half of the patients reported playing online games (n=15). Comorbid problems were common (n=22) and included (social) anxiety disorders, PDD NOS, ADHD/ADD, Parent-Child relationship problem, and various types of depressive mood problems. The sensitivity of the test was good:  results further show that the C-VAT correctly identified 91% of the sample at the proposed cut-off score of at least 5 out of 9 of the criteria. As our study did not include healthy, extreme gamers, we could not assess the specificity of the tool: future research should make this a priority. CONCLUSION: Using the proposed DSM-5 cut-off score, the C-VAT 2.0 shows preliminary validity in a sample of gamers in treatment for gaming disorder, but the discriminating value of the instrument should be studied further. In the meantime, it is crucial that therapists try to avoid false positives by using expert judgment of functional impairment in each case.",treatment,0.6328555678059536,1
34,"Development and User Satisfaction of ""Plan-It Commander,"" a Serious Game for Children with ADHD.",2015 Dec,"Bul KC, Franken IH, Van der Oord S, Kato PM, Danckaerts M, Vreeke LJ, Willems A, van Oers HJ, van den Heuvel R, van Slagmaat R, Maras A",Games for health journal,"Journal Article, Research Support, Non-U.S. Gov't",None,https://doi.org/10.1089/g4h.2015.0021,"The need for engaging treatment approaches within mental health care has led to the application of gaming approaches to existing behavioral training programs (i.e., gamification). Because children with attention deficit/hyperactivity disorder (ADHD) tend to have fewer problems with concentration and engagement when playing digital games, applying game technologies and design approaches to complement treatment may be a useful means to engage this population in their treatment. Unfortunately, gamified training programs currently available for ADHD have been limited in their ability to demonstrate in-game behavior skills that generalize to daily life situations. Therefore, we developed a new serious game (called ""Plan-It Commander"") that was specifically designed to promote behavioral learning and promotes strategy use in domains of daily life functioning such as time management, planning/organizing, and prosocial skills that are known to be problematic for children with ADHD. An interdisciplinary team contributed to the  development of the game. The game's content and approach are based on psychological principles from the Self-Regulation Model, Social Cognitive Theory, and Learning Theory. In this article, game development and the scientific background of the behavioral approach are described, as well as results of a survey (n = 42) to gather user feedback on the first prototype of the game. The findings suggest that participants were satisfied with this game and provided the basis for further development and research to the game. Implications for developing serious games and applying user feedback in game development are discussed.",treatment,0.21499448732083792,1
