index,Article Title,Date,Authors,Journal,Study Type,Keywords,DOI,Abstract,Topic of interest,Score,Match
48,A comparison of behavioral parent training programs for fathers of children with  attention-deficit/hyperactivity disorder.,2009 Jun,"Fabiano GA, Chacko A, Pelham WE Jr, Robb J, Walker KS, Wymbs F, Sastry AL, Flammer L, Keenan JK, Visweswaraiah H, Shulman S, Herbst L, Pirvics L",Behavior therapy,"Comparative Study, Journal Article, Randomized Controlled Trial, Research Support, N.I.H., Extramural, Research Support, U.S. Gov't, Non-P.H.S.",None,https://doi.org/10.1016/j.beth.2008.05.002,"Few behavioral parent training (BPT) treatment studies for attention-deficit/hyperactivity disorder (ADHD) have included and measured outcomes with fathers. In this study, fathers were randomly assigned to attend a  standard BPT program or the Coaching Our Acting-Out Children: Heightening Essential Skills (COACHES) program. The COACHES program included BPT plus sports  skills training for the children and parent-child interactions in the context of  a soccer game. Groups did not differ at baseline, and father ratings of treatment outcome indicated improvement at posttreatment for both groups on measures of child behavior. There was no significant difference between groups on ADHD-related measures of child outcome. However, at posttreatment, fathers who participated in the COACHES program rated children as more improved, and they were significantly more engaged in the treatment process (e.g., greater attendance and arrival on time at sessions, more homework completion, greater consumer satisfaction). The implications for these findings and father-related treatment efforts are discussed.",treatment,0.3891951488423374,1
49,The effect of methylphenidate on Internet video game play in children with attention-deficit/hyperactivity disorder.,2009 May-Jun,"Han DH, Lee YS, Na C, Ahn JY, Chung US, Daniels MA, Haws CA, Renshaw PF",Comprehensive psychiatry,"Journal Article, Research Support, Non-U.S. Gov't",None,https://doi.org/10.1016/j.comppsych.2008.08.011,"OBJECTIVE: A number of studies about attention-deficit/hyperactivity disorder (ADHD) and Internet video game play have examined the prefrontal cortex and dopaminergic system. Stimulants such as methylphenidate (MPH), given to treat ADHD, and video game play have been found to increase synaptic dopamine. We hypothesized that MPH treatment would reduce Internet use in subjects with co-occurring ADHD and Internet video game addictions. METHODS: Sixty-two children (52 males and 10 females), drug-naive, diagnosed with ADHD, and Internet video game players, participated in this study. At the beginning of the study and after 8 weeks of treatment with Concerta (OROS methylphenidate HCl, Seoul, Korea), participants were assessed with Young's Internet Addiction Scale, Korean version  (YIAS-K), Korean DuPaul's ADHD Rating Scale, and the Visual Continuous Performance Test. Their Internet usage time was also recorded. RESULTS: After 8 weeks of treatment, the YIAS-K scores and Internet usage times were significantly reduced. The changes in the YIAS-K scores between the baseline and 8-week assessments were positively correlated with the changes in total and inattention  scores from the Korean DuPaul's ADHD Rating Scale, as well as omission errors from the Visual Continuous Performance Test. There was also a significant difference in the number of omission errors among non-Internet-addicted, mildly Internet addicted, and severely Internet addicted participants. DISCUSSION: We suggest that Internet video game playing might be a means of self-medication for  children with ADHD. In addition, we cautiously suggest that MPH might be evaluated as a potential treatment of Internet addiction.",treatment,0.6780595369349504,1
50,Attention deficit hyperactivity disorder symptoms mediate early-onset smoking.,2009,"Huizink AC, van Lier PA, Crijnen AA",European addiction research,"Comparative Study, Journal Article, Randomized Controlled Trial",None,https://doi.org/10.1159/000173003,"BACKGROUND/AIMS: Symptoms of attention deficit hyperactivity disorder (ADHD) have often been associated with early-onset smoking. We hypothesize that reductions in ADHD symptoms due to an intervention have a mediating effect on early-onset smoking. METHODS: In a universal, school-based, randomized controlled intervention trial, we examined whether intervention-induced reductions in ADHD symptoms at age 9 mediated the reduced risk of tobacco use onset among these children at age 10 or 11 years. A sample of 477 first-grade boys and girls were randomly assigned to the Good Behavior Game intervention (n = 263), a 2-year (grades 2 and 3) universal classroom-based intervention aimed at reducing disruptive behavior problems, or to a control condition (n = 214). ADHD symptoms  were assessed through teacher ratings. Early onset of tobacco use was assessed through self-report. RESULTS: The intervention-induced reductions in ADHD symptoms fully mediated the distal effect of intervention on reductions in early-onset smoking. CONCLUSIONS: Our results showed that programs that target ADHD symptoms may protect children from early-onset smoking as well. Further research is needed to examine pathways from ADHD symptoms to tobacco use.",treatment,0.6648291069459756,1
51,Serotonergic functioning and trait-impulsivity in attention-deficit/hyperactivity-disordered boys (ADHD): influence of rapid tryptophan depletion.,2008 Jan,"Zepf FD, Stadler C, Demisch L, Schmitt M, Landgraf M, Poustka F",Human psychopharmacology,"Clinical Trial, Journal Article, Randomized Controlled Trial, Research Support, Non-U.S. Gov't",None,https://doi.org/10.1002/hup.896,"OBJECTIVE: The present study investigated the effects of rapid tryptophan depletion (RTD) and the ensuing reduction of central nervous levels of serotonin  (5-HT) on reactive aggression with respect to personality factors comprising aspects of trait-impulsivity and -aggression in boys with attention-deficit/hyperactivity-disorder (ADHD). METHODS: Twenty-two male adolescent patients with ADHD received the RTD test on one day, and, on another day a tryptophan balanced placebo in a double-blind within-subject crossover design. Impulsive personality factors and trait-impulsivity were assessed in advance of the study. Aggression was provoked using a competitive reaction time game 270 min after RTD/placebo intake. RESULTS: RTD had a significant effect on increased aggressive behaviour with which low-grade impulsive patients responded. High-grade impulsive patients were not affected by RTD or even responded with increased aggressive behaviour while receiving placebo treatment. CONCLUSIONS: The present study supports the hypothesis that 5-HT functioning in ADHD patients  influences reactive aggression depending on aspects of trait-impulsivity. Future  studies are necessary in order to detect the specific influence of ADHD as regards the relevance to 5-HT-induced changed aggressive responding.",treatment,0.49944873208379265,1
52,"Infrequent, but not frequent, reinforcers produce more variable responding and deficient sustained attention in young children with attention-deficit/hyperactivity disorder (ADHD).",2006 May,"Aase H, Sagvolden T","Journal of child psychology and psychiatry, and allied disciplines","Controlled Clinical Trial, Journal Article, Research Support, Non-U.S. Gov't",None,https://doi.org/10.1111/j.1469-7610.2005.01468.x,"BACKGROUND: The underlying behavioral/psychological processes of attention-deficit/hyperactivity disorder are unclear. Motivational factors, related to dopamine dysfunction, may play an important role in the development of the behavioral symptoms. Particularly, infrequent, but not frequent, reinforcers  have been suggested to be associated with altered responding and deviant behavior in children with ADHD. The present study was designed to analyze the influence of reinforcement frequency on operationalized measures of hyperactivity, impulsiveness, sustained attention, and response variability. METHODS: Fifty-six  boys, half of whom were diagnosed with ADHD, completed a computerized task presented as a game with two squares on the screen. One square was associated with reinforcement. The task required responses by the computer mouse under contingencies alternating between variable interval schedules of short (mean 2 s) and long (mean 20 s) durations. Reinforcers were cartoon pictures and small trinkets. RESULTS: Overall, there was no difference between children with ADHD and comparison children when reinforcers were given frequently. Statistically significant differences on measures of sustained attention and variability, but not hyperactivity and impulsiveness, were found during infrequent reinforcement only. Age effects interacted with group effects on sustained attention, showing that group differences were found in the young children only. Surprisingly, older comparison children showed increased response variability and no learning. CONCLUSIONS: When reinforcers are infrequent, children with ADHD show deficient sustained attention and increased variability in responding. Computer experience  may have interfered with measures of hyperactivity and impulsiveness. The unexpectedly poor performance of the older comparison children may have been due  to inefficient reinforcers or to verbally governed behavior overruling reinforcer effects. Reinforcer characteristics and experimental procedures are important factors influencing findings in studies investigating motivational factors. The study provides some support for the dynamic developmental theory of ADHD predicting relationships between neurobiological deficits, altered reinforcement  mechanisms, and treatment recommendations.",treatment,0.5545755237045203,1
53,Neurofeedback in adolescents and adults with attention deficit hyperactivity disorder.,2005 May,Butnik SM,Journal of clinical psychology,"Case Reports, Comparative Study, Journal Article, Review",None,https://doi.org/10.1002/jclp.20124,"Neurofeedback is being utilized more commonly today in treating individuals who have attention deficit hyperactivity disorder (ADHD). Neurofeedback, which is based on theories that recognize the organic basis of ADHD, utilizes biofeedback  to guide individuals to regulate their brain activity. Neurofeedback relies on research that has demonstrated that most individuals who have ADHD, as compared to matched peers, have excess slow wave activity and reduced fast wave activity.  It provides immediate feedback to the individual about his or her brain wave activity in the form of a video game, whose action is influenced by the individual's meeting predetermined thresholds of brain activity. Over several sessions of using the video and auditory feedback, individuals reduce their slow  wave activity and/or increase their fast wave activity. Individuals who complete  a course of training sessions often show reduced primary ADHD symptoms. Research  has shown that neurofeedback outcomes compare favorably to those of stimulant medication.",treatment,0.49944873208379265,1
54,Once-a-day Concerta methylphenidate versus three-times-daily methylphenidate in laboratory and natural settings.,2001 Jun,"Pelham WE, Gnagy EM, Burrows-Maclean L, Williams A, Fabiano GA, Morrisey SM, Chronis AM, Forehand GL, Nguyen CA, Hoffman MT, Lock TM, Fielbelkorn K, Coles EK, Panahon CJ, Steiner RL, Meichenbaum DL, Onyango AN, Morse GD",Pediatrics,"Clinical Trial, Comparative Study, Journal Article, Research Support, Non-U.S. Gov't, Research Support, U.S. Gov't, P.H.S.",None,https://doi.org/10.1542/peds.107.6.e105,"OBJECTIVE: Methylphenidate (MPH), the most commonly prescribed drug for attention-deficit/hyperactivity disorder (ADHD), has a short half-life, which necessitates multiple daily doses. The need for multiple doses produces problems  with medication administration during school and after-school hours, and therefore with compliance. Previous long-acting stimulants and preparations have  shown effects equivalent to twice-daily dosing of MPH. This study tests the efficacy and duration of action, in natural and laboratory settings, of an extended-release MPH preparation designed to last 12 hours and therefore be equivalent to 3-times-daily dosing. METHODS: Sixty-eight children with ADHD, 6 to 12 years old, participated in a within-subject, double-blind comparison of placebo, immediate-release (IR) MPH 3 times a day (tid), and Concerta, a once-daily MPH formulation. Three dosing levels of medication were used: 5 mg IR  MPH tid/18 mg Concerta once a day (qd); 10 mg IR MPH tid/36 mg Concerta qd; and 15 mg IR MPH tid/54 mg Concerta qd. All children were currently medicated with MPH at enrollment, and each child's dose level was based on that child's MPH dosing before the study. The doses of Concerta were selected to be comparable to  the daily doses of MPH that each child received. To achieve the ascending rate of MPH delivery determined by initial investigations to provide the necessary continuous coverage, Concerta doses were 20% higher on a daily basis than a comparable tid regimen of IR MPH. Children received each medication condition for 7 days. The investigation was conducted in the context of a background clinical behavioral intervention in both the natural environment and the laboratory setting. Parents received behavioral parent training and teachers were taught to  establish a school-home daily report card (DRC). A DRC is a list of individual target behaviors that represent a child's most salient areas of impairment. Teachers set daily goals for each child's impairment targets, and parents provided rewards at home for goal attainment. Each weekday, teachers completed the DRC, and it was used as a dependent measure of individualized medication response. Teachers and parents also completed weekly standardized ratings of behavior and treatment effectiveness. To evaluate the time course of medication effects, children spent 12 hours in a laboratory setting on Saturdays and medication effects were measured using procedures and methods adapted from our summer treatment program. Measures of classroom behavior and academic productivity/accuracy were taken in a laboratory classroom setting during which children completed independent math and reading worksheets. Measures of social behavior were taken in structured, small-group board game settings and unstructured recess settings. Measures included behavior frequency counts, academic problems completed and accuracy, independent observations, teacher and counselor ratings, and individualized behavioral target goals. Reports of adverse events, sleep quality, and appetite were collected. RESULTS: On virtually all measures in all settings, both drug conditions were significantly different from  placebo, and the 2 drugs were not different from each other. In children's regular school settings, both medications improved behavior as measured by teacher ratings and individualized target behaviors (the DRC); these effects were seen into the evening as measured by parent ratings. In the laboratory setting, effects of Concerta were equivalent to tid MPH and lasted at least through 12 hours after dosing. Concerta was significantly superior to tid MPH on 2 parent rating scores, and when asked, more parents preferred Concerta than preferred tid IR MPH or placebo. Side effects on children's sleep and appetite were similar for the 2 preparations. In the lab setting, both medications improved productivity and accuracy on arithmetic seatwork assignments, disruptive and on-task behavior, and classroom rule following. Both medications improved children's rule following and negative behavior in small group board games, as well as in unstructured recess settings. Individual target behaviors also showed significant improvement  with medication across domains in the laboratory setting. Children's behavior across settings deteriorated across the laboratory day, and the primary effect of medication was to prevent this deterioration as the day wore on. Results support  the use of background behavioral treatment in clinical trials of stimulant medication, and illustrate the utility of a measure of individualized daily target goals (ie, the DRC) as an objective measure of medication response in both the laboratory and natural school settings. CONCLUSION: This investigation clearly supports the efficacy of the Concerta long-acting formulation of MPH for  parents who desire to have medication benefits for their child throughout the day and early evening. (ABSTRACT TRUNCATED)",treatment,0.11686879823594266,0
55,Is instrumental variability abnormally high in children exhibiting ADHD and aggressive behavior?,1998 Jul,"Saldana L, Neuringer A",Behavioural brain research,"Journal Article, Research Support, Non-U.S. Gov't, Research Support, U.S. Gov't, Non-P.H.S.",None,https://doi.org/10.1016/s0166-4328(97)00169-1,"To test whether instrumental behavior of some children with attention deficit hyperactivity disorder (ADHD) is more variable than control subjects, the sequences of responses by three groups of children were compared: (i) those diagnosed with ADHD who lived in a residential treatment facility for children demonstrating aggressive behavior; (ii) age-matched children from the same facility who did not have an ADHD diagnosis but who had also demonstrated abnormal levels of aggression; and (iii) normal children from a local school. The experiment consisted of rewarding children for responding in a computer 'game' on two keys of a keyboard during each of three phases. In phase 1, rewards were provided independently of sequence variability (IND). In phase 2, rewards depended upon highly variable sequences of left and right responses. Phase 3 was  a return to the IND contingencies. The results showed that sequence variability was higher in the sequence variability (VARY) phase than in the preceding IND phase, but remained high when the contingencies returned to IND, thus replicating previous findings. In none of the phases did the ADHD children respond more variably than the controls. However, ADHD subjects made more off-task responses than did controls. Thus, although the present research showed differences between ADHD and control subjects, there was no evidence to support higher behavioral variability in the ADHD subjects.",treatment,0.38919514884233736,1
56,What they want and what they get: the social goals of boys with ADHD and comparison boys.,1996 Apr,"Melnick SM, Hinshaw SP",Journal of abnormal child psychology,"Clinical Trial, Controlled Clinical Trial, Journal Article, Research Support, U.S. Gov't, P.H.S.",None,https://doi.org/10.1007/BF01441483,"Twenty-seven boys diagnosed with attention-deficit hyperactivity disorder (ADHD)  and 18 comparison boys participated in a competitive tetradic interaction task. Boys were individually interviewed before the game about their goals for the interaction, and adult observers inferred boys' social goals from videotapes of the interaction. Social acceptance was determined by combining positive and negative sociometric nominations collected through individual interviews at the end of the summer research program in which the interaction was held. In their self-reports, ADHD-high aggressive boys prioritized trouble-seeking and fun at the expense of rules to a greater extent than did both ADHD-low aggressive and comparison boys. Observers judged ADHD-high aggressive boys to seek attention more strongly and seek fairness less strongly than of the other two groups. Self-reported goals of defiance and cooperation predicted boys' end-of-program social standing, even with interactional behaviors and subgroup status controlled statistically. Observer-inferred goals were differentially associated with social acceptance for ADHD and comparison boys, suggesting discontinuities in peer interaction processes. Differentiation of goals from behavior and the integral role of children's goals in peer acceptance are discussed.",treatment,0.278941565600882,1
57,Malleability of social impressions of hyperactive children.,1993 Dec,"Granger DA, Whalen CK, Henker B",Journal of abnormal child psychology,"Clinical Trial, Journal Article, Randomized Controlled Trial, Research Support, Non-U.S. Gov't",None,https://doi.org/10.1007/BF00916447,"The role of adults' social cognitions in mediating judgments of hyperactive children's medication-related behavior change was explored. Two hundred eight-eight undergraduates observed two videotaped excerpts of a hyperactive ""target"" boy playing a group game with two peers. Each target was taking either methylphenidate (0.6 mg/kg) during both excerpts, placebo during both excerpts, methylphenidate first followed by placebo, or placebo first followed by methylphenidate. Adults' cumulative social evaluations of the child were assessed after they viewed both video segments. Results indicated that observers combined  their perceptions of the two behavior samples into composite impressions using an equal-weight averaging algorithm. Even for children whose behavior improved, adults' ratings of undercontrolled behaviors continued to meet or, in some cases  exceed, research cutoff scores used to identify hyperactive children. The findings suggest that the actual behaviors of children with attention-deficit hyperactivity disorder (ADHD) play a more influential role in shaping interpersonal impressions than do perceiver social-cognitive processes such as primacy, recency, or integration biases.",treatment,0.3340683572216097,1
58,Perceptions of methylphenidate effects on hyperactive children's peer interactions.,1993 Oct,"Granger DA, Whalen CK, Henker B",Journal of abnormal child psychology,Journal Article,None,https://doi.org/10.1007/BF00916318,"The behavioral constructs that emerge from observers' open-ended impressions of methylphenidate effects on the social behaviors of hyperactive children were examined. Ninety-six undergraduates observed videotapes of two different hyperactive ""target"" boys, each playing an interaction game with three peers. One target was taking methylphenidate and the other was taking placebo. The valence and content of observers' social perceptions were analyzed. Overall, more negative than positive behaviors were detected, a pattern more pronounced for the placebo than for the medication condition. Interestingly, placebo targets received negative evaluations for poorly controlled behaviors such as noncompliance, aggression, and disruption, but medicated targets received negative evaluations for social inhibition--passive and submissive behaviors. In  contrast, the boys' medication state did not consistently influence observers' perceptions of positive social behaviors. Discussion focused on the extent and consequences of medication-related increases in social disengagement and on the ultimate impact of stimulant treatment on hyperactive children's social worlds.",treatment,0.278941565600882,1
60,"Effects of background anger, provocation, and methylphenidate on emotional arousal and aggressive responding in attention-deficit hyperactivity disordered boys with and without concurrent aggressiveness.",1991 Aug,"Pelham WE, Milich R, Cummings EM, Murphy DA, Schaughency EA, Greiner AR",Journal of abnormal child psychology,"Journal Article, Research Support, U.S. Gov't, P.H.S.",None,https://doi.org/10.1007/BF00919086,"We investigated the effects of background anger, provocation, and methylphenidate on emotional, physiological, and behavioral responding in children with attention-deficit hyperactivity disorder (ADHD) with and without concurrent aggression. Our study revealed that ADHD boys showed more emotional and physiological distress when exposed to an interaction in which an administrator chastised each boy's favorite counselor, compared to a friendly interaction between the two adults. The background anger manipulation did not affect the aggressive behavior of the boys against an opponent in an aggressive game. High-aggressive (HA) ADHD boys were more likely to respond to provocation with aggression than low-aggressive (LA) ADHD boys, but only LA boys showed increased  physiological reactivity with increasing provocation. Methylphenidate resulted in increased heart rates under all conditions and did not interact with any of the other findings.",treatment,0.49944873208379265,1
61,Methylphenidate and baseball playing in ADHD children: who's on first?,1990 Feb,"Pelham WE, McBurnett K, Harper GW, Milich R, Murphy DA, Clinton J, Thiele C",Journal of consulting and clinical psychology,"Clinical Trial, Controlled Clinical Trial, Journal Article, Randomized Controlled Trial",None,https://doi.org/10.1037/0022-006X.58.1.130,"The effects of 0.3 and 0.6 mg/kg methylphenidate were analyzed in a double-blind, placebo-controlled, cross-over study in which 17 boys (ages 7.8-9.9 years) with attention deficit hyperactivity disorder (ADHD) played in baseball games. Drug effects were evaluated on children's attention during the game, as indicated by their on-task behavior on the field and their ability to answer questions about the status of the game at all times. Judgment during batting, batting skill during the game, and performance on skill drills prior to the game were also assessed as a function of medication. Results revealed that methylphenidate had a beneficial effect on attending during the game.",treatment,0.07497243660418963,0
