index,Article Title,Date,Authors,Journal,Study Type,Keywords,DOI,Abstract,Topic of interest,Score,Match
75,Is Screen Time Throughout Adolescence Related to ADHD? Findings from 1993 Pelotas (Brazil) Birth Cohort Study.,2022 Feb,"Soares PSM, de Oliveira PD, Wehrmeister FC, Menezes AMB, Goncalves H",Journal of attention disorders,"Journal Article, Research Support, Non-U.S. Gov't","*adolescents, *attention deficit disorder, *cognition, *longitudinal, *screen time",https://doi.org/10.1177/1087054721997555,"OBJECTIVE: This study investigated the association between screen time in adolescence and Attention Deficit Disorder (ADHD) at 22 years old. METHOD: A sample of 2333 participants aged 11 years old without ADHD from the 1993 Pelotas  Birth Cohort Study (Brazil) was followed up until the age of 22. Screen time variables included time spent in television, video game and computer at 11, 15, and 18 years old. ADHD was assessed at 22 years. RESULTS: ADHD symptoms at 22 years was positively associated with television time at 11 years, computer time at 18 years and total screen time at ages 11, 15, and 18 years. Television time at 11 years and total screen time at 18 years were associated with diagnosis of ADHD at 22 years of age. CONCLUSIONS: Our findings may contribute to future investigations of possible explanatory avenues for these associations.",diagnosis support,0.26232948583420773,1
76,Objective Assessment of Attention-Deficit Hyperactivity Disorder (ADHD) Using an  Infinite Runner-Based Computer Game: A Pilot Study.,2020 Oct 9,"Delgado-Gomez D, Sujar A, Ardoy-Cuadros J, Bejarano-Gomez A, Aguado D, Miguelez-Fernandez C, Blasco-Fontecilla H, Penuelas-Calvo I",Brain sciences,Journal Article,"ADHD, SWAN, e-health, inattention, video games",https://doi.org/10.3390/brainsci10100716,"In the last few years, several computerized tasks have been developed to increase the objectivity of the diagnosis of attention-deficit hyperactivity disorder (ADHD). This article proposes the ""running raccoon"" video game to assess the severity of inattention in patients diagnosed with ADHD. Unlike existing tests, the proposed tool is a genuine video game in which the patient must make a raccoon avatar jump to avoid falling into different gaps. The distance to the gap is recorded for each jump. To evaluate the proposed game, an experiment was conducted in which 32 children diagnosed with ADHD participated. For each participant, the median and interquartile range of these distances were calculated, along with the number of omissions. Experimental results showed a significant correlation between the participants' inattention (measured by the Attention-Deficit/Hyperactivity Disorder Symptoms and Normal Behavior rating scale (SWAN) inattention subscale) with each of these three measures. In addition to its accuracy, other benefits are its short duration and the possibility of being run on both standard computers and mobile devices. These characteristics facilitate its acceptance in clinical environments or even its telematic use. The obtained results, together with the characteristics of the video game, make it an excellent tool to support clinicians in the diagnosis of ADHD.",diagnosis support,0.7376705141657921,1
77,Training attention in children with acquired brain injury: a study protocol of a  randomised controlled trial of the TALI attention training programme.,2019 Dec 4,"McKay E, Richmond S, Kirk H, Anderson V, Catroppa C, Cornish K",BMJ open,"Clinical Trial Protocol, Journal Article, Research Support, Non-U.S. Gov't","*clinical trials, *developmental neurology & neurodisability, *education & training (see medical education & training)",https://doi.org/10.1136/bmjopen-2019-032619,"INTRODUCTION: Childhood inattention has been linked with poor academic outcomes,  and increased lifetime social, occupational and psychiatric morbidity. Children with an acquired brain injury (ABI) are particularly susceptible to attention deficits and may benefit from interventions aimed at enhancing attention. The primary objective of this study is to evaluate the short-term efficacy of the TALI Train programme, compared with a placebo, on the outcome of attention in children with ABI. METHODS AND ANALYSIS: The study is a parallel, double-blind, randomised controlled trial. Participants will consist of 80 children with a diagnosis of ABI aged 4-9 years 11 months. Participants will be randomly allocated to either (1) TALI Train (intervention group), an adaptive game-based attention training programme, or (2) a non-adaptive placebo programme (control group). Both programmes are delivered on a touchscreen tablet, and children complete five 20 min sessions per week for a 5-week period at home. Assessment of selective, sustained and executive attention (primary outcomes), and behavioural  attention, working memory, social skills and mathematics ability (secondary outcomes) will occur at baseline, post-training, and at 3-month and 6-month follow-up to assess immediate and long-term efficacy of TALI Train compared with  placebo. Assessments will be completed at the Royal Children's Hospital in Melbourne, Australia. All assessments and analyses will be undertaken by researchers blinded to group membership. Latent growth curve modelling will be employed to examine primary and secondary outcomes. ETHICS AND DISSEMINATION: Ethics approval has been obtained from the Royal Children's Hospital Human Research Ethics Committee (HREC) (38132) and the Monash University HREC (17446).  Results will be disseminated through peer-reviewed journals, conference presentations, media outlets, the internet and various community/stakeholder activities. TRIAL REGISTRATION NUMBER: ACTRN12619000511134.",diagnosis support,0.018887722980062957,0
78,"To eat or not to eat: Reward delay impulsivity in children with loss of control eating, attention deficit / hyperactivity disorder, a double diagnosis, and healthy children.",2019,"Munsch S, Dremmel D, Wilhelm P, Baierle S, Fischer S, Hilbert A",PloS one,"Journal Article, Research Support, Non-U.S. Gov't",None,https://doi.org/10.1371/journal.pone.0221814,"Reward delay impulsivity is a feature of attention deficit/hyperactivity disorder (ADHD) and a likely feature of loss of control eating (LOC-E), which might explain the higher risk of children with ADHD or LOC-E to become obese. The goal  of this study was to investigate reward delay impulsivity in children with LOC-E, ADHD, or a double diagnosis, in contrast to healthy children. Children (8 to 13 years) with LOC-E (n = 24), ADHD (n = 33), a double diagnosis (n = 9), and healthy children (n = 34) performed a computer game (door opening task [DOT]) and the delay of gratification task (DoGT) to assess food related facets of reward delay impulsivity. In addition, children reported whether they worried to lose control over eating during the DoGT. There were no group differences in the DOT.  However, children with ADHD or a double diagnosis had a significantly higher risk to eat prematurely during the DoGT than children with LOC-E, who were not significantly different from healthy children. Children with a double diagnosis were most likely to worry about losing control over eating during the DoGT, followed by children with LOC-E, and both had a significantly higher probability  to worry than healthy children. For children with a double diagnosis the probability to worry was significantly higher than for children with ADHD. If replicated, these findings point to a special relevance of reward delay impulsivity in children with ADHD or a double diagnosis, compared to children with LOC-E. ADHD should be regularly assessed in children with LOC-E.",diagnosis support,0.7355718782791184,1
79,Brain-computer-interface-based intervention re-normalizes brain functional network topology in children with attention deficit/hyperactivity disorder.,2018 Aug 10,"Qian X, Loo BRY, Castellanos FX, Liu S, Koh HL, Poh XWW, Krishnan R, Fung D, Chee MW, Guan C, Lee TS, Lim CG, Zhou J",Translational psychiatry,"Journal Article, Randomized Controlled Trial, Research Support, Non-U.S. Gov't",None,https://doi.org/10.1038/s41398-018-0213-8,"A brain-computer-interface (BCI)-based attention training game system has shown promise for treating attention deficit/hyperactivity disorder (ADHD) children with inattentive symptoms. However, little is known about brain network organizational changes underlying behavior improvement following BCI-based training. To cover this gap, we aimed to examine the topological alterations of large-scale brain functional networks induced by the 8-week BCI-based attention intervention in ADHD boys using resting-state functional magnetic resonance imaging method. Compared to the non-intervention (ADHD-NI) group, the intervention group (ADHD-I) showed greater reduction of inattention symptoms accompanied with differential brain network reorganizations after training. Specifically, the ADHD-NI group had increased functional connectivity (FC) within the salience/ventral attention network (SVN) and increased FC between task-positive networks (including the SVN, dorsal attention (DAN), somatomotor, and executive control network) and subcortical regions; in contrast ADHD-I group  did not have this pattern. In parallel, ADHD-I group had reduced degree centrality and clustering coefficient as well as increased closeness in task-positive and the default mode networks (prefrontal regions) after the training. More importantly, these reduced local functional processing mainly in the SVN were associated with less inattentive/internalizing problems after 8-week BCI-based intervention across ADHD patients. Our findings suggest that the BCI-based attention training facilitates behavioral improvement in ADHD children  by reorganizing brain functional network from more regular to more random configurations, particularly renormalizing salience network processing. Future long-term longitudinal neuroimaging studies are needed to develop the BCI-based intervention approach to promote brain maturation in ADHD.",diagnosis support,0.7932843651626441,1
80,A serious game for children with Attention Deficit Hyperactivity Disorder: Who benefits the most?,2018,"Bul KCM, Doove LL, Franken IHA, Oord SV, Kato PM, Maras A",PloS one,"Journal Article, Multicenter Study, Randomized Controlled Trial, Research Support, Non-U.S. Gov't",None,https://doi.org/10.1371/journal.pone.0193681,"OBJECTIVE: The aim of the current study was to identify which subgroups of children with Attention Deficit Hyperactivity Disorder (ADHD) benefitted the most from playing a Serious Game (SG) intervention shown in a randomized trial to improve behavioral outcomes. METHOD: Pre-intervention characteristics [i.e., gender, age, intellectual level of functioning, medication use, computer experience, ADHD subtype, severity of inattention problems, severity of hyperactivity/impulsivity problems, comorbid Oppositional Defiant Disorder (ODD)  and Conduct Disorder (CD) symptoms] were explored as potential moderators in a Virtual Twins (VT) analysis to identify subgroups for whom the SG intervention was most effective. Primary outcome measures were parent-reported time management, planning/organizing and cooperation skills. RESULTS: Two subgroups were identified. Girls (n = 26) were identified as the subgroup that was most likely to show greater improvements in planning/organizing skills as compared to  the estimated treatment effect of the total group of participants. Furthermore, among the boys, those (n = 47) with lower baseline levels of hyperactivity and higher levels of CD symptoms showed more improvements in their planning/organizing skills when they played the SG intervention as compared to the estimated treatment effect of the total group of participants. CONCLUSION: Using a VT analysis two subgroups of children with ADHD, girls, and boys with both higher levels of CD and lower levels of hyperactivity, were identified. These subgroups mostly benefit from playing the SG intervention developed to improve ADHD related behavioral problems. Our results imply that these subgroups  have a higher chance of treatment success.",diagnosis support,0.47848898216159497,1
81,"A Randomized Controlled Trial of an Integrated Brain, Body, and Social Intervention for Children With ADHD.",2020 Mar,"Smith SD, Vitulano LA, Katsovich L, Li S, Moore C, Li F, Grantz H, Zheng X, Eicher V, Aktan Guloksuz S, Zheng Y, Dong J, Sukhodolsky DG, Leckman JF",Journal of attention disorders,"Journal Article, Randomized Controlled Trial, Research Support, N.I.H., Extramural","*ADHD, *Good Behavior Game (GBG), *computerized cognitive remediation training (CCRT), *physical exercise, *randomized controlled trial",https://doi.org/10.1177/1087054716647490,"Objective: This study evaluated the efficacy of an Integrated Brain, Body, and Social (IBBS) intervention for children with ADHD. Treatment consisted of computerized cognitive remediation training, physical exercises, and a behavior management strategy. Method: Ninety-two children aged 5 to 9 years with ADHD were randomly assigned to 15 weeks of IBBS or to treatment-as-usual. Primary outcome measures included blinded clinician ratings of ADHD symptoms and global clinical  functioning. Secondary outcome measures consisted of parent and teacher ratings of ADHD and neurocognitive tests. Results: No significant treatment effects were  found on any of our primary outcome measures. In terms of secondary outcome measures, the IBBS group showed significant improvement on a verbal working memory task; however, this result did not survive correction for multiple group comparisons. Conclusion: These results suggest that expanding cognitive training  to multiple domains by means of two training modalities does not lead to generalized improvement of ADHD symptomatology.",diagnosis support,0.5309548793284365,1
82,"The Groundskeeper Gaming Platform as a Diagnostic Tool for Attention-Deficit/Hyperactivity Disorder: Sensitivity, Specificity, and Relation  to Other Measures.",2016 Oct,"Faraone SV, Newcorn JH, Antshel KM, Adler L, Roots K, Heller M",Journal of child and adolescent psychopharmacology,"Comparative Study, Journal Article, Research Support, Non-U.S. Gov't","*ADHD, *biomarker, *decision-making, *diagnosis, *gaming",https://doi.org/10.1089/cap.2015.0174,"OBJECTIVE: The purpose of this study was to assess the relative accuracies of the Conners' Brief Rating Scale, Parent Version, the Conners' Continuous Performance  Test II (CPT II), and a novel interactive game called ""Groundskeeper"" to discriminate child psychiatric patients with and without attention-deficit/hyperactivity disorder (ADHD). METHODS: We administered the three assessments to 113 clinically referred ADHD and non-ADHD patients who had been diagnosed with the Kiddie-Schedule of Affective Disorders and Schizophrenia- Present and Lifetime (K-SADS-PL), Version 19. RESULTS: As measured by the area under the curve (AUC) statistic from receiver operating characteristic (ROC) analysis, the diagnostic accuracy of Groundskeeper (0.79) was as high as the accuracy of the Conners' parent rating of inattention (0.76) and better than the  CPT II percent correct (0.62). Combining the three tests produced an AUC of 0.87. Correlations among the three measures were small and, mostly, not significant. CONCLUSIONS: Our finding of similar diagnostic accuracies between Groundskeeper and the Conners' inattention scale is especially remarkable given that the Conners' inattention scale shares method variance with the diagnostic process. Although our work is preliminary, it suggests that computer games may be useful in the diagnostic process. This provides an important direction for research, given the objectivity of such measures and the fact that computer games are well  tolerated by youth.",diagnosis support,0.6820566631689401,1
83,Behavioral Outcome Effects of Serious Gaming as an Adjunct to Treatment for Children With Attention-Deficit/Hyperactivity Disorder: A Randomized Controlled Trial.,2016 Feb 16,"Bul KC, Kato PM, Van der Oord S, Danckaerts M, Vreeke LJ, Willems A, van Oers HJ, Van Den Heuvel R, Birnie D, Van Amelsvoort TA, Franken IH, Maras A",Journal of medical Internet research,"Journal Article, Randomized Controlled Trial, Research Support, Non-U.S. Gov't","ADHD, Internet, attention deficit-hyperactivity disorder, children, randomized controlled trial, serious game, treatment",https://doi.org/10.2196/jmir.5173,"BACKGROUND: The need for accessible and motivating treatment approaches within mental health has led to the development of an Internet-based serious game intervention (called ""Plan-It Commander"") as an adjunct to treatment as usual for children with attention-deficit/hyperactivity disorder (ADHD). OBJECTIVE: The aim was to determine the effects of Plan-It Commander on daily life skills of children with ADHD in a multisite randomized controlled crossover open-label trial. METHODS: Participants (N=170) in this 20-week trial had a diagnosis of ADHD and ranged in age from 8 to 12 years (male: 80.6%, 137/170; female: 19.4%, 33/170). They were randomized to a serious game intervention group (group 1; n=88) or a treatment-as-usual crossover group (group 2; n=82). Participants randomized to group 1 received a serious game intervention in addition to treatment as usual for the first 10 weeks and then received treatment as usual for the next 10 weeks. Participants randomized to group 2 received treatment as usual for the first 10 weeks and crossed over to the serious game intervention in addition to treatment as usual for the subsequent 10 weeks. Primary (parent report) and secondary (parent, teacher, and child self-report) outcome measures were administered at baseline, 10 weeks, and 10-week follow-up. RESULTS: After 10 weeks, participants in group 1 compared to group 2 achieved significantly greater improvements on the primary outcome of time management skills (parent-reported; P=.004) and on secondary outcomes of the social skill of responsibility (parent-reported; P=.04), and working memory (parent-reported; P=.02). Parents and teachers reported that total social skills improved over time within groups,  whereas effects on total social skills and teacher-reported planning/organizing skills were nonsignificant between groups. Within group 1, positive effects were  maintained or further improved in the last 10 weeks of the study. Participants in group 2, who played the serious game during the second period of the study (weeks 10 to 20), improved on comparable domains of daily life functioning over time. CONCLUSIONS: Plan-It Commander offers an effective therapeutic approach as an adjunct intervention to traditional therapeutic ADHD approaches that improve functional outcomes in daily life. TRIAL REGISTRATION: International Standard Randomized Controlled Trial Number (ISRCTN): 62056259; http://www.controlled-trials.com/ISRCTN62056259 (Archived by WebCite at http://www.webcitation.org/6eNsiTDJV).",diagnosis support,0.7408184679958026,1
84,Neural correlates of reactive aggression in children with attention-deficit/hyperactivity disorder and comorbid disruptive behaviour disorders.,2016 Apr,"Bubenzer-Busch S, Herpertz-Dahlmann B, Kuzmanovic B, Gaber TJ, Helmbold K, Ullisch MG, Baurmann D, Eickhoff SB, Fink GR, Zepf FD",Acta psychiatrica Scandinavica,"Journal Article, Research Support, Non-U.S. Gov't","aggressive behaviour, attention-deficit/hyperactivity disorder, disruptive behaviour disorders, fMRI, point subtraction aggression game",https://doi.org/10.1111/acps.12475,"OBJECTIVE: Attention deficit hyperactivity disorder (ADHD) is often linked with impulsive and aggressive behaviour, indexed by high comorbidity rates between ADHD and disruptive behaviour disorders (DBD). The present study aimed to investigate underlying neural activity of reactive aggression in children with ADHD and comorbid DBD using functional neuroimaging techniques (fMRI). METHOD: Eighteen boys with ADHD (age 9-14 years, 10 subjects with comorbid DBD) and 18 healthy controls were administered a modified fMRI-based version of the 'Point Subtraction Aggression Game' to elicit reactive aggressive behaviour. Trials consisted of an 'aggression phase' (punishment for a fictitious opponent) and an  'outcome phase' (presentation of the trial outcome). RESULTS: During the aggression phase, higher aggressive responses of control children were accompanied by higher activation of the ventral anterior cingulate cortex and the temporoparietal junction. Patients displayed inverted results. During the outcome phase, comparison between groups and conditions showed differential activation in the dorsal striatum and bilateral insular when subjects gained points. Losing points was accompanied by differential activation of regions belonging to the insula and the middle temporal sulcus. CONCLUSION: Data support the hypothesis that deficient inhibitory control mechanisms are related to increased impulsive aggressive behaviour in young people with ADHD and comorbid DBD.",diagnosis support,0.5309548793284365,1
85,Working memory and cognitive flexibility-training for children with an autism spectrum disorder: a randomized controlled trial.,2015 May,"de Vries M, Prins PJ, Schmand BA, Geurts HM","Journal of child psychology and psychiatry, and allied disciplines","Journal Article, Randomized Controlled Trial, Research Support, Non-U.S. Gov't","Executive functioning, autism, cognitive training, flexibility, working memory",https://doi.org/10.1111/jcpp.12324,"BACKGROUND: People with autism spectrum disorders (ASDs) experience executive function (EF) deficits. There is an urgent need for effective interventions, but  in spite of the increasing research focus on computerized cognitive training, this has not been studied in ASD. Hence, we investigated two EF training conditions in children with ASD. METHODS: In a randomized controlled trial, children with ASD (n = 121, 8-12 years, IQ > 80) were randomly assigned to an adaptive working memory (WM) training, an adaptive cognitive flexibility-training, or a non-adaptive control training (mock-training). Braingame Brian, a computerized EF-training with game-elements, was used. Outcome measures (pretraining, post-training, and 6-week-follow-up) were near-transfer to trained EFs, far-transfer to other EFs (sustained attention and inhibition), and  parent's ratings of daily life EFs, social behavior, attention deficit hyperactivity disorder (ADHD)-behavior, and quality of life. RESULTS: Attrition-rate was 26%. Children in all conditions who completed the training improved in WM, cognitive flexibility, attention, and on parent's ratings, but not in inhibition. There were no significant differential intervention effects, although children in the WM condition showed a trend toward improvement on near-transfer WM and ADHD-behavior, and children in the cognitive flexibility condition showed a trend toward improvement on near-transfer flexibility. CONCLUSION: Although children in the WM condition tended to improve more in WM and ADHD-behavior, the lack of differential improvement on most outcome measures, the absence of a clear effect of the adaptive training compared to the mock-training, and the high attrition rate suggest that the training in its present form is probably not suitable for children with ASD.",diagnosis support,0.17943336831059808,1
86,Clinical features of young children referred for impairing temper outbursts.,2013 Nov,"Roy AK, Klein RG, Angelosante A, Bar-Haim Y, Leibenluft E, Hulvershorn L, Dixon E, Dodds A, Spindel C",Journal of child and adolescent psychopharmacology,"Journal Article, Research Support, N.I.H., Extramural, Research Support, Non-U.S. Gov't",None,https://doi.org/10.1089/cap.2013.0005,"OBJECTIVE: In light of the current controversy about whether severe temper outbursts are diagnostic of mania in young children, we conducted a study to characterize such children, focusing on mania and other mood disorders, emotion regulation, and parental psychiatric history. METHODS: Study participants included 51 5-9-year-old children with frequent, impairing outbursts (probands) and 24 non-referred controls without outbursts. Parents completed a lifetime clinical interview about their child, and rated their child's current mood and behavior. Teachers completed a behavior rating scale. To assess emotion regulation, children were administered the Balloons Game, which assesses emotion  expressivity in response to frustration, under demands of high and low regulation. Parental lifetime diagnoses were ascertained in blind clinical interviews. RESULTS: No child had bipolar disorder, bipolar disorder not otherwise specified (NOS), or major depression (MDD). The most prevalent disorder was oppositional defiant disorder (88.2%), followed by attention-deficit/hyperactivity disorder (74.5%), anxiety disorders (49.0%), and  non-MDD depressive disorders (33.3%). Eleven probands (21.6%) met criteria for severe mood dysregulation. During the Balloons Game, when there were no demands for self-regulation, children with severe outbursts showed reduced positive expressivity, and also showed significant deficits in controlling negative facial expressions when asked to do so. Anxiety disorders were the only diagnoses significantly elevated in probands' mothers. CONCLUSIONS: Overall, young children with severe temper outbursts do not present with bipolar disorder. Rather, disruptive behavior disorders with anxiety and depressive mood are common. In children with severe outbursts, deficits in regulating emotional facial expressions may reflect deficits controlling negative affect. This work represents a first step towards elucidating mechanisms underlying severe outbursts in young children.",diagnosis support,0.025183630640083943,0
